{
  "attestation_view_pin": "91152c47665199a76605c9db9b091b185b59b617e1574ae82dc2e9eb2309cdfe",
  "candidate_only": true,
  "cycle_id": "P21B-F1",
  "evaluator_judgment_required": true,
  "exemplar_view_pin": "5f902a3b5510953b5d034443bbb4e66581f750fb36f1de180094ff07122bde6f",
  "manuscript_path": "manuscript/main.tex",
  "manuscript_sha256": "675e560225b973ac71a7a9b97846616a198f07dec7d2163b5a0e8fb14c24ee04",
  "passage_scope_class": "technical",
  "phase": "Ph3",
  "profile_path": "references/policies/reader_accessibility.v1.json",
  "profile_sha256": "821c99b606b4b72df6ed8ad719712341c23927510babab82108dc6c907f08277",
  "register_class": "domain-native",
  "schema_version": "reader_accessibility_candidates.v1",
  "source_bindings": [
    {
      "path": "references/policies/reader_accessibility.v1.json",
      "role": "package_profile",
      "scope": "package",
      "sha256": "821c99b606b4b72df6ed8ad719712341c23927510babab82108dc6c907f08277"
    },
    {
      "path": "references/READER_ACCESSIBILITY.md",
      "role": "package_contributor",
      "scope": "package",
      "sha256": "eb08c404acb48ccfb660a2faca28977ecd5d9aae22913233ecb1393a76a971a5"
    },
    {
      "path": "references/examples/model_prose_corpus.md",
      "role": "package_contributor",
      "scope": "package",
      "sha256": "d24a186b2f118076c63ed47396738ce0ad95008907d87b455ffab9dcb3013812"
    }
  ],
  "sub_checks": {
    "A": {
      "applicable": true,
      "candidates": [],
      "deterministic_disposition": "candidate_probe"
    },
    "B": {
      "applicable": true,
      "deterministic_disposition": "judgment_only",
      "reason": "rhythm and C-8 functional guards require Evaluator judgment"
    },
    "C": {
      "applicable": true,
      "deterministic_disposition": "judgment_only",
      "reason": "first-use conceptual work cannot be established by token order alone"
    },
    "D": {
      "applicable": true,
      "candidates": [],
      "deterministic_disposition": "candidate_probe"
    },
    "E": {
      "applicable": true,
      "candidates": [],
      "deterministic_disposition": "candidate_probe"
    },
    "F": {
      "applicable": true,
      "candidates": [],
      "deterministic_disposition": "candidate_probe"
    },
    "G": {
      "applicable": true,
      "candidates": [],
      "deterministic_disposition": "candidate_probe",
      "headings": 0,
      "long_manuscript_proxy": false,
      "proxy_label": "word-and-cue gap proxy candidate; not the construct-accumulation predicate",
      "total_words": 7
    },
    "H": {
      "applicable": true,
      "bundles": [
        {
          "binding_status": "binding",
          "candidate_status": "overlay_positive_marker_audit_required",
          "locator": "line 1:chars 0-47",
          "negative_prefilter_fired": false,
          "passage_role": "section_framing",
          "probes": {
            "hedging": {
              "fired": false,
              "name": "hedging",
              "normalised": 0.0,
              "raw_count": 0,
              "threshold": 2.0
            },
            "nominalisation": {
              "fired": false,
              "name": "nominalisation",
              "normalised": 0.0,
              "raw_count": 0,
              "threshold": 0.08
            },
            "prep_run": {
              "fired": false,
              "name": "prep_run",
              "normalised": 1.0,
              "raw_count": 1,
              "threshold": 3.0
            }
          },
          "role_confidence": "medium",
          "role_reason": "uncued opening span after a heading",
          "word_count": 7
        }
      ],
      "deterministic_disposition": "candidate_probe",
      "ph2_scope": null,
      "positive_marker_audit_required": true,
      "surface_warrant_source_keys": [
        "yu-1995-istar",
        "yu-mylopoulos-1994-modelling-strategic-actor-relationships-bpr-8p",
        "yu-mylopoulos-1994-understanding-why-software-process-modelling",
        "yu-1997-early-phase-re",
        "yu-e-agent-orientation-as-a-modeling-paradigm-2001",
        "yu-et-al-2011-social-modeling",
        "yu-2024-nine-pivots",
        "yu-2025-social-agentics-crosstalk",
        "yu-lapouchnian-2025-social-agentics-bdi-star",
        "zave-1997-four-dark-corners-re",
        "nuseibeh-2000-re-a-roadmap",
        "goncalves-2019-istar-extension"
      ]
    }
  }
}
